{
  "api_version": "llm.temporal/v1",
  "operation_key": "fixture-openrouter-chat-best-effort",
  "model": "router-model",
  "service_class": "standard",
  "service_class_fallbacks": [],
  "portability": "best_effort",
  "instructions": [],
  "input": [{"kind": "message", "actor": "human", "content": [{"kind": "text", "text": "best effort"}]}],
  "tools": [],
  "tool_policy": {"mode": "auto", "parallel": false},
  "sampling": {"top_k": 4},
  "continuation": null,
  "extensions": {}
}
