{
  "api_version": "llm.temporal/v1",
  "operation_key": "fixture-anthropic-direct-strict-loss",
  "model": "claude-contract",
  "service_class": "standard",
  "service_class_fallbacks": [],
  "portability": "strict",
  "instructions": [],
  "input": [{"kind": "message", "actor": "human", "content": [{"kind": "text", "text": "strict loss"}]}],
  "tools": [],
  "tool_policy": {"mode": "auto", "parallel": false},
  "sampling": {"seed": 1},
  "continuation": null,
  "extensions": {}
}
