{
  "api_version": "llm.temporal/v1",
  "operation_key": "fixture-openai-chat",
  "model": "chat-contract",
  "service_class": "standard",
  "service_class_fallbacks": [],
  "portability": "strict",
  "instructions": [],
  "input": [
    {
      "kind": "message",
      "actor": "human",
      "content": [{"kind": "text", "text": "fixture chat"}]
    }
  ],
  "tools": [],
  "tool_policy": {"mode": "auto", "parallel": false},
  "continuation": null,
  "extensions": {}
}
